time,id,score,max,min,avg,std,sentense
7,010,0.84,0.84,0.84,0.84,0.84,The most recent time that I feel happy is.
40,010,0.89,0.89,0.84,0.865,0.03535533905932741,"Our user testing runs successfully and very fluently, and I feel like this is the most wonderful thing that happens during this period of time and also we got some we gotta lot useful insights from our user testing and our participants are actively engaging in our testing process so I feel like."
51,010,0.8,0.89,0.8,0.8433333333333334,0.04509249752822893,During the communication with them. I got not only the incense for our projects also some.
55,010,0.82,0.89,0.8,0.8375,0.038622100754188225,Some experience some.
62,010,0.93,0.93,0.8,0.856,0.053197744313081566,Positive experience for my life.
84,010,0.21,0.93,0.21,0.7483333333333333,0.26798631805871487,Because they have that kind of disease and they also have a positive attitude towards life and not make me feel like I need to leave harder and play harder. I work harder. This kind of stuff and also drill found the most proper.
91,010,0.23,0.93,0.21,0.6742857142857143,0.3134143765505524,Algorithm for processing our data so I also feel like Oh Wonderful Yeah.
